price per months,price per week,number of bed,location
£370 pcm,£85 pw,2 bed terraced house to rent,"Eldon Street, Darlington DL3"
£450 pcm,£104 pw,2 bed flat to rent,"121 Salisbury Terrace, Darlington DL3"
£475 pcm,£110 pw,2 bed flat to rent,"Scargill Court, Darlington DL1"
£525 pcm,£121 pw,2 bed terraced house to rent,"Salisbury Terrace, Darlington DL3"
£525 pcm,£121 pw,2 bed property to rent,"Stanhope Road South, Darlington DL3"
£475 pcm,£110 pw,2 bed bungalow to rent,"Lowson Street, Darlington, County Durham DL3"
£550 pcm,£127 pw,2 bed flat to rent,"Uplands Road, Darlington DL3"
£39 pcm,£9 pw,Property to rent,"Spruce Grove, Darlington DL3"
£495 pcm,£114 pw,2 bed terraced house to rent,"Rydal Road, Darlington DL1"
£400 pcm,£92 pw,1 bed flat to rent,"Bondgate, Darlington DL3"
£625 pcm,£144 pw,3 bed property to rent,"Surtees Street, Darlington DL3"
£600 pcm,£138 pw,2 bed property to rent,"John Williams Boulevard, Darlington DL1"
£500 pcm,£115 pw,2 bed terraced house to rent,"Wilson Street, Darlington DL3"
£800 pcm,£185 pw,3 bed detached house to rent,"Meadowsweet Lane, Darlington DL1"
£595 pcm,£137 pw,2 bed terraced house to rent,"Eastbourne Road, Darlington DL1"
£800 pcm,£185 pw,3 bed semi-detached house to rent,"Highbury Road, Darlington DL3"
£475 pcm,£110 pw,2 bed terraced house to rent,"Kitchener Street, Darlington DL3"
"£1,750 pcm",£404 pw,2 bed terraced house to rent,"Trafalgar Terrace, Darlington DL3"
£850 pcm,£196 pw,3 bed terraced house to rent,"Quaker Lane, Darlington DL1"
£850 pcm,£196 pw,3 bed property to rent,"Amberley Grove, Faverdale, Darlington DL3"
£450 pcm,£104 pw,2 bed terraced house to rent,"Barningham Street, Darlington DL3"
£425 pcm,£98 pw,2 bed terraced house to rent,"Beaconsfield Street, Darlington DL3"
£450 pcm,£104 pw,2 bed terraced house to rent,"St. Johns Crescent, Darlington DL1"
£475 pcm,£110 pw,2 bed flat to rent,"West Auckland Road, Darlington DL3"
£500 pcm,£115 pw,2 bed flat to rent,"Westmoreland Court, Darlington DL3"
